{
    "schema": "OperatorVerdict@1",
    "operatorId": "alpha",
    "modelHash": "0xa9f05c04e2d6297d041947fb757f692f6bc0b1489b7b8d4bd2190c3ad1d4a81d",
    "address": "0xabcdef1234567890abcdef1234567890abcdef12",
    "state": "CONFIRMED",
    "level": "confirmed",
    "confidence": 9500,
    "anomalyScore": 0.87,
    "sequenceScore": 0.93,
    "observations": 4,
    "triggeringTxHash": "0x7f5c81b53c20e1b2a6f9b4a8f1d2e3c4b5a69788fedcba0987654321abcdef01",
    "pattern": "flash_loan_oracle",
    "victimProtocol": "0x1111111111111111111111111111111111111111",
    "observedAt": "2026-04-17T14:32:17.128Z"
}
